<?xml version="1.0" encoding="utf-8" ?>
<Datatable xmlns:xsi="http://www.w3.org/2001/XMLSchema-instance" xmlns:xsd="http://www.w3.org/2001/XMLSchema" xsi:noNamespaceSchemaLocation="../../Schemas/HullDefinition.xsd">

    <!-- ******************** -->
    <!-- **   CasperTest   ** -->
    <!-- ******************** -->

    <!--  SLOT EXAMPLES - Undefined, Weapon, Defense
    <Slot Name="Slot01" RestrictedModuleCategory="Undefined">
        <Direction X="0" Z="1"/>
    </Slot>
    <WeaponSlot RestrictedWeaponType="Kinetic" RestrictedModuleCategory="Undefined">
        <Direction X="0" Z="1"/>
        <VisualSlot Name="MDL_Wp_Small_Up_00"></VisualSlot>
    </WeaponSlot> 


        <Link>
            <SlotName>SectionW.Slot01</SlotName>
            <SlotName>SectionE.Slot01</SlotName>
        </Link>
            
            <TechnologyPrerequisite Flags="Prerequisite,Discard,Technology">TechnologyShip1</TechnologyPrerequisite>
            
            Note that visual slot name only currently uses 'weapon modules', so a support module will simply not show up. Also adding weapons without 'visual slots' will still impact battle it is simply not visible.
            
            
            Use technology pre-requisite to hide ships (See Mothership/Hero ships)
            ** FLAGS **
            Edition = Ship Designer
            Discard = Constructible list or Hide slot in GUI
            Disable = Grey out slot in GUI
    -->

    <!-- **  Vampirilis Small Attack Hull   ** -->
    <HullDefinition Name="HullSmall01Vampirilis" ScoreProvider="WarShipConstructed" Category="CategoryHull" SubCategory="SubCategoryShipDesign">
        <CustomCost ResourceName="SystemProduction">200</CustomCost>
        <!-- S2 costs here -->

        <PathPrerequisite Flags="Prerequisite,Discard">ClassColonizedStarSystem,ColonizedStarSystemStateColony</PathPrerequisite>
        <PathPrerequisite Flags="Prerequisite,Discard,Edition">../ClassEmpire,AffinityMappingVampirilis</PathPrerequisite>        
        <TechnologyPrerequisite Flags="Prerequisite,Edition,Technology,Discard">TechnologyHull2Vampirilis</TechnologyPrerequisite>

        <SimulationDescriptorReference Name="ClassHullSmallAttack"/>
        <SimulationDescriptorReference Name="WeaponAvailabilityKinetic"/>
        <SimulationDescriptorReference Name="WeaponAvailabilityBeam"/>
        <SimulationDescriptorReference Name="WeaponAvailabilityLaser"/>
        <SimulationDescriptorReference Name="ShipSizeSmall"/>
        <SimulationDescriptorReference Name="ShipFactionVampirilis"/>
        <SimulationDescriptorReference Name="ShipHull01"/>

        <ShipDesignLayout>
            <ShipRoleReference Name="ShipRoleSmallAttacker"/>
            <SectionPattern_Eight>
                <!-- Core Section -->
                <CoreSection Name="CoreSection">
                    <VisualSectionName>Core</VisualSectionName>
                    <SimulationDescriptorReference Name="ClassSectionCore"/>
                    <SimulationDescriptorReference Name="ClassSectionCoreSmallOffense"/>
                    <Slot Name="Support01">
                        <RestrictedModuleCategory>Support</RestrictedModuleCategory>
                        <RestrictedModuleCategory>Defense</RestrictedModuleCategory>
                        <Direction X="0" Z="1"/>
                        <UISlotName>UICore07</UISlotName>
                    </Slot>
                    <Slot Name="Defense01">
                        <RestrictedModuleCategory>Defense</RestrictedModuleCategory>
                        <Direction X="0" Z="1"/>
                        <UISlotName>UICore08</UISlotName>
                    </Slot>
                    <Slot Name="Weapon01" ShowPositionMarker="true" PositionMarkerAngle="120">
                        <Cost ResourceName="Strategic1" Instant="true">1</Cost>
                        <TechnologyPrerequisite Flags="Prerequisite,Discard">TechnologyImproveHull1</TechnologyPrerequisite>
						<RestrictedModuleCategory>Weapon</RestrictedModuleCategory>
                        <RestrictedWeaponType>Kinetic</RestrictedWeaponType>
                        <RestrictedWeaponType>Missile</RestrictedWeaponType>
                        <RestrictedWeaponType>Laser</RestrictedWeaponType>
                        <RestrictedWeaponType>Beam</RestrictedWeaponType>
                        <RestrictedWeaponType>KineticRailgun</RestrictedWeaponType>
                        <RestrictedWeaponType>BoardingPod</RestrictedWeaponType>
                        <LineOfSight>
                            <Direction X="0" Z="1"/>
                            <Angle>270</Angle>
                            <VisualSlot Name="MDL_Wp_Small_Up_00"></VisualSlot>
                        </LineOfSight>
                        <ModuleModifier>
                            <SimulationDescriptorReference Name="TopWeapon"/>
                        </ModuleModifier>
                        <UISlotName>UICoreWeapon09</UISlotName>
                    </Slot>
                </CoreSection>

                <!-- Forward Section -->
                <Section Name="SectionN">
                    <VisualSectionName>Front</VisualSectionName>
                    <Slot Name="Support01">
                        <Cost ResourceName="Strategic1" Instant="true">1</Cost>
                        <TechnologyPrerequisite Flags="Prerequisite,Discard">TechnologyImproveHull1</TechnologyPrerequisite>
                        <RestrictedModuleCategory>Support</RestrictedModuleCategory>
                        <Direction X="0" Z="1"/>
                        <UISlotName>UIFront01</UISlotName>
                    </Slot>
                    <Slot Name="Defense01">
                        <Cost ResourceName="Strategic1" Instant="true">1</Cost>
                        <TechnologyPrerequisite Flags="Prerequisite,Discard">TechnologyImproveHull1</TechnologyPrerequisite>
                        <RestrictedModuleCategory>Defense</RestrictedModuleCategory>
                        <Direction X="0" Z="1"/>
                        <UISlotName>UIFront02</UISlotName>
                    </Slot>
                </Section>

                <!-- Forward/Right Section -->
                <Section Name="SectionNE">
                    <VisualSectionName>FrontRight</VisualSectionName>
                    <Slot Name="Defense01">
                        <RestrictedModuleCategory>Defense</RestrictedModuleCategory>
                        <Direction X="1" Z="0"/>
                        <UISlotName>UIFrontRight03</UISlotName>
                    </Slot>
                </Section>

                <!-- Right Section -->
                <Section Name="SectionE">
                    <VisualSectionName>Right</VisualSectionName>
                    <Slot Name="Weapon01" ShowPositionMarker="true" PositionMarkerAngle="30">
						<RestrictedModuleCategory>Weapon</RestrictedModuleCategory>
                        <RestrictedWeaponType>Kinetic</RestrictedWeaponType>
                        <RestrictedWeaponType>Missile</RestrictedWeaponType>
                        <RestrictedWeaponType>Laser</RestrictedWeaponType>
                        <RestrictedWeaponType>Beam</RestrictedWeaponType>
                        <RestrictedWeaponType>KineticRailgun</RestrictedWeaponType>
                        <RestrictedWeaponType>BoardingPod</RestrictedWeaponType>
                        <LineOfSight>
                            <Direction X="1" Z="0"/>
                            <Angle>120</Angle>
                            <VisualSlot Name="MDL_Wp_SmallSide_Right_00"></VisualSlot>
                        </LineOfSight>
                        <LineOfSight>
                            <Direction X="-1" Z="0"/>
                            <Angle>120</Angle>
                            <VisualSlot Name="MDL_Wp_SmallSide_Left_00"></VisualSlot>
                        </LineOfSight>
                        <UISlotName>UIRightWeapon04</UISlotName>
                    </Slot>
                </Section>

                <!-- Back/Right Section -->
                <Section Name="SectionSE">
                    <VisualSectionName>BackRight</VisualSectionName>
                </Section>

                <!-- Back Section -->
                <Section Name="SectionS">
                    <VisualSectionName>Back</VisualSectionName>
                    <Slot Name="Support01">
                        <RestrictedModuleCategory>Support</RestrictedModuleCategory>
                        <Direction X="0" Z="-1"/>
                        <UISlotName>UIBack05</UISlotName>
                    </Slot>
                    <Slot Name="Weapon01" ShowPositionMarker="true" PositionMarkerAngle="120">
						<RestrictedModuleCategory>Weapon</RestrictedModuleCategory>
                        <RestrictedWeaponType>Kinetic</RestrictedWeaponType>
                        <RestrictedWeaponType>Missile</RestrictedWeaponType>
                        <RestrictedWeaponType>Laser</RestrictedWeaponType>
                        <RestrictedWeaponType>Beam</RestrictedWeaponType>
                        <RestrictedWeaponType>KineticRailgun</RestrictedWeaponType>
                        <RestrictedWeaponType>BoardingPod</RestrictedWeaponType>
                        <LineOfSight>
                            <Direction X="0" Z="1"/>
                            <Angle>270</Angle>
                            <VisualSlot Name="MDL_Wp_Small_Up_01"></VisualSlot>
                        </LineOfSight>
                        <ModuleModifier>
                            <SimulationDescriptorReference Name="TopWeapon"/>
                        </ModuleModifier>
                        <UISlotName>UIBackWeapon06</UISlotName>
                    </Slot>
                </Section>